{
  "schema_version": "1",
  "status": "complete",
  "examined_scope": {
    "user_id": "01995600-0000-7000-8000-000000000003",
    "project_id": "01995600-0000-7000-8000-000000000004",
    "task_id": "01995600-0000-7000-8000-000000000005",
    "entity_ids": [
      "01995600-0000-7000-8000-000000000006"
    ],
    "source_versions": [
      {
        "source_id": "01995600-0000-7000-8000-000000000007",
        "revision": "C"
      }
    ]
  },
  "inputs": {
    "sources": [
      {
        "source_id": "01995600-0000-7000-8000-000000000007",
        "revision": "C"
      }
    ],
    "memories": [],
    "artifacts": []
  },
  "findings": [
    {
      "statement": "The instance query for W-101 returned no fire-resistance value.",
      "origin": "observed",
      "evidential_status": "observation",
      "sources": [
        {
          "source_id": "01995600-0000-7000-8000-000000000007",
          "revision": "C"
        }
      ],
      "supporting_memories": [],
      "challenging_memories": [],
      "applicability": {
        "user_id": "01995600-0000-7000-8000-000000000003",
        "project_id": "01995600-0000-7000-8000-000000000004",
        "task_id": "01995600-0000-7000-8000-000000000005",
        "entity_ids": [
          "01995600-0000-7000-8000-000000000006"
        ],
        "source_versions": [
          {
            "source_id": "01995600-0000-7000-8000-000000000007",
            "revision": "C"
          }
        ]
      }
    },
    {
      "statement": "Revision C stores FireResistance = 120 min on type WT-12.",
      "origin": "observed",
      "evidential_status": "observation",
      "sources": [
        {
          "source_id": "01995600-0000-7000-8000-000000000007",
          "revision": "C"
        }
      ],
      "supporting_memories": [],
      "challenging_memories": [],
      "applicability": {
        "user_id": "01995600-0000-7000-8000-000000000003",
        "project_id": "01995600-0000-7000-8000-000000000004",
        "task_id": "01995600-0000-7000-8000-000000000005",
        "entity_ids": [
          "01995600-0000-7000-8000-000000000006"
        ],
        "source_versions": [
          {
            "source_id": "01995600-0000-7000-8000-000000000007",
            "revision": "C"
          }
        ]
      }
    }
  ],
  "coverage": {
    "examined": [
      "instance-empty",
      "schema-location",
      "type-property"
    ],
    "unexamined": []
  },
  "unresolved_work": [],
  "proposed_changes": [],
  "child_outputs": [],
  "result_artifact": null,
  "known_effects": [],
  "usage": {
    "status": "known",
    "input_tokens": 0,
    "output_tokens": 0,
    "cost": {
      "currency": "USD",
      "minor_units": 0
    }
  }
}
